{"config":{"ref":"configs/rl/naive_geneval2_grpo_v0_1.yaml","sha256":"e1c287633c3c9f4e9ad8e1e80f2dc8a00efcaad982625bd39091a255478dffee"},"execution_profile":"qwen_dual_backend@1","experiment_id":"naive_geneval2_grpo_v0_1_s42","method":"naive_geneval2_grpo@0.1","official_geneval2_800_reserved_for_one_time_external_evaluation":true,"optimization":{"clip_ratio_high":0.28,"clip_ratio_low":0.2,"learning_rate":1e-06,"ppo_epochs":1,"reference_kl_coefficient":0.02,"train_epochs":1},"policy":{"action_protocol_version":"0.5","checkpoint_sha256":"b2377728e0cd748447e27a9583c1456121a20aff84da9468da14e9cb16cd2718","planner_context_schema_version":"0.7","revision":"flow1000_v9_selective_skill_full_s42"},"primary_metrics":["submitted_geneval2_pass_count","submitted_geneval2_soft_tifa_gm","all_atoms_pass_rate","image_calls_per_episode"],"reward_policy":"geneval2_terminal_outcome@0.1","rollout":{"max_action_tokens":1400,"max_episode_assistant_tokens":16000,"max_image_attempts":5,"rollouts_per_prompt":4,"seed":42,"temperature":0.7,"top_k":-1,"top_p":0.95},"schema_version":"0.1","splits":{"confirmation":{"manifest_id":"naive_grpo_confirmation_v0_1_s42","ref":"artifacts/phase8/naive_grpo_confirmation_manifest_v0_1.json","selected_count":500,"sha256":"ea3b29ab45320d1cc0f263d0cbeca1beb736e7296bc5dfcc435b3607c5caf99f"},"development":{"manifest_id":"naive_grpo_development_v0_1_s42","ref":"artifacts/phase8/naive_grpo_development_manifest_v0_1.json","selected_count":200,"sha256":"bf9f605a1356e77f38012b7ccc56fd7f95ba9ea80d8a25bfe29bd05011985d3b"},"train":{"manifest_id":"naive_grpo_train_v0_1_s42","ref":"artifacts/phase8/naive_grpo_train_manifest_v0_1.json","selected_count":1000,"sha256":"2c0745f206950c3e3b9b5c57a024298a88d32fed6d4ce6aca20e845492c477f5"}},"stopping_and_scale":{"conditional_expand_to_prompts":1000,"first_efficacy_prompts":500,"increase_rollouts_to":6,"maximum_policy_invalid_fraction":0.05,"maximum_zero_variance_group_fraction":0.35,"minimum_trainable_prompts":250,"minimum_valid_group_fraction":0.95,"pilot_prompts":128,"smoke_prompts":32}}
